{
  "name": "SearchIndexingApplication",
  "displayName": "Search Indexing Application",
  "description": "Search Reindexing Application",
  "appType": "internal",
  "developer": "Collate Inc.",
  "developerUrl": "https://www.getcollate.io",
  "privacyPolicyUrl": "https://www.getcollate.io",
  "supportEmail": "support@getcollate.io",
  "scheduleType": "Scheduled",
  "permission": "All",
  "className": "org.openmetadata.service.apps.bundles.searchIndex.SearchIndexApp",
  "runtime": {
    "enabled": "true"
  },
  "appConfiguration": {
    "entities": [
      "table",
      "dashboard",
      "topic",
      "pipeline",
      "searchIndex",
      "user",
      "team",
      "glossaryTerm",
      "mlmodel",
      "tag",
      "classification",
      "query",
      "container",
      "database",
      "databaseSchema",
      "testCase",
      "testSuite",
      "chart",
      "dashboardDataModel",
      "databaseService",
      "messagingService",
      "dashboardService",
      "pipelineService",
      "mlmodelService",
      "searchService",
      "entityReportData",
      "webAnalyticEntityViewReportData",
      "webAnalyticUserActivityReportData",
      "domain",
      "storedProcedure",
      "dataProduct"
    ],
    "recreateIndex": "false",
    "batchSize": "100",
    "searchIndexMappingLanguage": "EN"
  }
}